{
  "schema_version": "eval_run.v1",
  "eval_run_id": "evr_549a5eda66c44563b94c4f7b27",
  "suite": "stage3_scoring",
  "status": "succeeded",
  "started_at": "2026-08-07T05:35:00.411041+00:00",
  "finished_at": "2026-08-07T05:35:00.411041+00:00",
  "version_manifest": {
    "manifest_id": "pipeline_stage3_stage3_v6_qwen2.5vl_7b",
    "version_manifest_hash": "27a755d1c00cceec2f455f6eda9eeba0d8ef141031814818a5cc72b5fbfdfcda"
  },
  "dataset": {
    "name": "golden_apr_jul_2026",
    "version": "0.2.0",
    "labels_sha256": "747adbdee48bae4c116c5e476cee00af5f496abdc713fd405f95c8bd4e2a4f36",
    "manifest_sha256": "0b207c2e7228be679e04b076d97e967fc8be0cd377dafbae7494f02d2d3f71c5"
  },
  "metrics": {
    "schema": "metrics.stage3_scoring.v1",
    "spearman_overall": 0.19729023787084118,
    "pearson_overall": 0.2848091614389922,
    "mae_overall": 17.3028,
    "rmse_overall": 22.922723223910374,
    "n_scored": 250,
    "per_dim": {
      "focus_sharpness": {
        "n": 0,
        "mae": NaN,
        "spearman": NaN
      },
      "exposure_control": {
        "n": 0,
        "mae": NaN,
        "spearman": NaN
      },
      "noise_cleanliness": {
        "n": 0,
        "mae": NaN,
        "spearman": NaN
      },
      "composition_framing": {
        "n": 0,
        "mae": NaN,
        "spearman": NaN
      },
      "light_color_character": {
        "n": 0,
        "mae": NaN,
        "spearman": NaN
      },
      "moment_peak": {
        "n": 0,
        "mae": NaN,
        "spearman": NaN
      },
      "atmosphere_impact": {
        "n": 0,
        "mae": NaN,
        "spearman": NaN
      },
      "deliverable_subject": {
        "n": 0,
        "mae": NaN,
        "spearman": NaN
      }
    },
    "selection": {
      "n": 250,
      "n_positives": 56,
      "at_k": [
        {
          "k": 10,
          "precision": 0.3,
          "recall": 0.05357142857142857,
          "overlap": 3
        },
        {
          "k": 20,
          "precision": 0.4,
          "recall": 0.14285714285714285,
          "overlap": 8
        },
        {
          "k": 50,
          "precision": 0.36,
          "recall": 0.32142857142857145,
          "overlap": 18
        }
      ],
      "score_gap": 7.539322533136968
    },
    "macro_dim_mae": null,
    "parse_fail_rate": 0.0
  },
  "artifact_root": "reports/eval/runs/evr_549a5eda66c44563b94c4f7b27",
  "baseline_run_id": null,
  "protocol": {
    "schema_version": "1",
    "generated_at": "2026-08-07T05:35:00.114313+00:00",
    "git_sha": "ab53680",
    "seed": null,
    "hardware": {
      "platform": "macOS-15.3.1-arm64-arm-64bit-Mach-O",
      "machine": "arm64",
      "processor": "arm",
      "python": "3.13.12",
      "cpu_count": 10,
      "torch": null,
      "cuda_available": false,
      "system": "Darwin"
    },
    "model": {
      "config_path": "configs/eval_stage3.yaml",
      "config_sha256_prefix": "0116e3830ddb6d4b",
      "provider": "ollama",
      "model_name": "qwen2.5vl:7b",
      "temperature": 0.0,
      "num_predict": 512,
      "fallback_model_name": null
    },
    "inputs": {
      "labels": {
        "path": "data/eval/labels.jsonl",
        "sha256_prefix": "747adbdee48bae4c"
      },
      "predictions": {
        "path": "data/eval/predictions_stage2.json",
        "sha256_prefix": "6ccdb7a78a4dd610"
      }
    },
    "extra": {
      "version_manifest": {
        "manifest_id": "pipeline_stage3_stage3_v6_qwen2.5vl_7b",
        "version_manifest_hash": "27a755d1c00cceec2f455f6eda9eeba0d8ef141031814818a5cc72b5fbfdfcda"
      },
      "prompt_version": "stage3_v6",
      "prompt_content_hash": "dd4de5b037f5592132dca96a3ed3550f37f89b758db20ae026c9afc8e0620119",
      "workflow_config_hash": "7d5206e94719f2bdd4f47c42ae6471af3dadfc8412f9ac1e8a39ce9b1ce408af",
      "manifest_path": "reports/eval/version_manifest.json"
    }
  },
  "counts": {
    "items_total": 250,
    "items_scored": 250,
    "items_matched": 250,
    "parse_fail": 0
  },
  "tags": [
    "stage3_scoring"
  ]
}
