{
  "schema_version": "eval_run.v1",
  "eval_run_id": "evr_f7d7817fff924c4aa9a8ba63e5",
  "suite": "stage3_scoring",
  "status": "succeeded",
  "started_at": "2026-08-08T06:23:32.985831+00:00",
  "finished_at": "2026-08-08T06:23:32.985831+00:00",
  "version_manifest": {
    "manifest_id": "pipeline_stage3_stage3_v7_qwen2.5vl_7b",
    "version_manifest_hash": "4f486e30aff78f371d0e90c02fca041ab4ae907fb933e26a4e633f48e884d3bb"
  },
  "dataset": {
    "name": "golden_apr_jul_2026",
    "version": "0.2.0",
    "labels_sha256": "86587c3fc2de6369e7bf07b8ea349f2b8b23e795e528f213d655b8b0108daf48",
    "manifest_sha256": "0b207c2e7228be679e04b076d97e967fc8be0cd377dafbae7494f02d2d3f71c5"
  },
  "metrics": {
    "schema": "metrics.stage3_scoring.v1",
    "spearman_overall": 0.5369656474978086,
    "pearson_overall": 0.5319656866783042,
    "mae_overall": 12.044400000000001,
    "rmse_overall": 16.575288836095737,
    "n_scored": 250,
    "per_dim": {
      "focus_sharpness": {
        "n": 236,
        "mae": 1.8539830508474575,
        "spearman": 0.5831178007396747
      },
      "exposure_control": {
        "n": 236,
        "mae": 1.3016949152542374,
        "spearman": 0.06982314010963867
      },
      "noise_cleanliness": {
        "n": 236,
        "mae": 1.059322033898305,
        "spearman": 0.45842717734263405
      },
      "composition_framing": {
        "n": 236,
        "mae": 1.5927966101694915,
        "spearman": -0.026846199520409904
      },
      "light_color_character": {
        "n": 236,
        "mae": 1.6707627118644068,
        "spearman": 0.15416207898122877
      },
      "moment_peak": {
        "n": 236,
        "mae": 1.3516949152542372,
        "spearman": 0.493117710242367
      },
      "atmosphere_impact": {
        "n": 236,
        "mae": 1.3915254237288135,
        "spearman": 0.21446409454709964
      },
      "deliverable_subject": {
        "n": 236,
        "mae": 1.4578813559322037,
        "spearman": 0.48132894958825156
      }
    },
    "selection": {
      "n": 250,
      "n_positives": 64,
      "at_k": [
        {
          "k": 3,
          "precision": 1.0,
          "recall": 0.046875,
          "overlap": 3
        },
        {
          "k": 5,
          "precision": 0.6,
          "recall": 0.046875,
          "overlap": 3
        },
        {
          "k": 10,
          "precision": 0.5,
          "recall": 0.078125,
          "overlap": 5
        }
      ],
      "score_gap": 10.445749327956989
    },
    "macro_dim_mae": 1.459957627118644,
    "parse_fail_rate": 0.0
  },
  "artifact_root": "reports/eval/runs/evr_f7d7817fff924c4aa9a8ba63e5",
  "baseline_run_id": null,
  "protocol": {
    "schema_version": "1",
    "generated_at": "2026-08-08T06:23:32.618594+00:00",
    "git_sha": "ab53680",
    "seed": null,
    "hardware": {
      "platform": "macOS-15.3.1-arm64-arm-64bit-Mach-O",
      "machine": "arm64",
      "processor": "arm",
      "python": "3.13.12",
      "cpu_count": 10,
      "torch": null,
      "cuda_available": false,
      "system": "Darwin"
    },
    "model": {
      "config_path": "configs/eval_stage3.yaml",
      "config_sha256_prefix": "1f83ec6b2594bf4e",
      "provider": "ollama",
      "model_name": "qwen2.5vl:7b",
      "temperature": 0.0,
      "num_predict": 512,
      "fallback_model_name": null
    },
    "inputs": {
      "labels": {
        "path": "data/eval/labels.jsonl",
        "sha256_prefix": "86587c3fc2de6369"
      },
      "predictions": {
        "path": "reports/eval/predictions/stage3_v7_qwen25vl7b_analysis_results.json",
        "sha256_prefix": "0547c1813ba0635d"
      }
    },
    "extra": {
      "version_manifest": {
        "manifest_id": "pipeline_stage3_stage3_v7_qwen2.5vl_7b",
        "version_manifest_hash": "4f486e30aff78f371d0e90c02fca041ab4ae907fb933e26a4e633f48e884d3bb"
      },
      "prompt_version": "stage3_v7",
      "prompt_content_hash": "e8a0d8c930d4ec53eab466ff43729a5c11d9cf1eb0f9f51c7e5932012b96b72a",
      "workflow_config_hash": "7d5206e94719f2bdd4f47c42ae6471af3dadfc8412f9ac1e8a39ce9b1ce408af",
      "manifest_path": "reports/eval/version_manifest.json"
    }
  },
  "counts": {
    "items_total": 250,
    "items_scored": 250,
    "items_matched": 250,
    "parse_fail": 0
  },
  "tags": [
    "stage3_scoring"
  ]
}
